Questions,Manual Label,NSQ,LDA,LSA,Cognitive,Knowledge
Just trace the algorithms for n =,14,0.067495,1,0.36604,2,2
Represent the disk movements by flipping bits in a binary n-tuple.,21,0.766476363,0.717984401,0.503647,3,3
Trace the algorithm on the input given. You will have to use it again in order to compute the products of two-digit numbers as well.,14,0.383408117,0.376318081,0.480508,2,2
Take logarithms of both sides of the equality. b. What did we use the closed-form formula for?,8,0.350236802,0.682203559,0.31577,2,1
"How do we multiply by powers of 10? b. Try to repeat the argument for, say, 98. Counting the number of one-digit additions made by the pen-and-pencil algorithm in multiplying, say, two four-digit numbers, should help answer the general question. ",9,0.695458019,0.210765417,0.439698,3,1
Check the formulas by simple algebraic manipulations.,8,0.181593867,0.254129543,0.496315,2,1
Trace Strassen's algorithm on the input given,14,0.657034853,0.231602439,0.854516,2,2
Use the method of backward substitutions to solve the recurrence given in the text.,14,0.963704891,0.403032068,0.729671,2,2
The recurrence for the number of multiplications in Pan's algorithm is similar to that for Strassen's algorithm. Use the Master Theorem to find the order of growth of its solution.,14,0.686390335,0.288046366,0.762377,2,2
Trace the algorithm as we did in solving another system in the section.,14,0.447570714,0.5,0.702441,2,2
Use the Gaussian elimination results as explained in the text. b. It is one of the varieties of the transform-and-conquer technique. Which one?,15,0.425444143,0.186032171,0.707291,3,2
Find the inverse. You can either solve the system with three simultaneous right-hand side vectors representing the columns of the 3 x 3 identity matrix or use the LU decomposition of the system's coefficient matrix,14,0.387887747,0.33905544,0.798706,2,2
"Though the final answer is correct, its derivation contains an error you have to find. ",15,0.291453169,0.166839902,0.613253,3,2
Estimate the ratio of the algorithm running times by using the approximate formulas for the number of divisions and the number of multiplications in both algorithms.,9,0.293512245,0.359378267,0.503049,3,1
Trace the algorithm outlined in the text on the input given.,14,0.341326467,0.271653597,0.685388,2,2
"Comment on the following: For a heap represented by an array, only the parental dominance requirement needs to be checked. ",9,0.608686742,0.260982615,0.831029,3,1
What structure does a complete tree of height h with the largest number of nodes have? What about a complete tree with the smallest number of nodes? b. Use the results established in part (a).,3,0.392023402,0.258181646,0.638828,3,0
"First, express the right-hand side as a function of h. Then, prove the obtained equality by either using the formula for the sum i2i given in Appendix A or by mathematical induction on h. ",14,0.585033746,0.281954495,0.40056,2,2
Where in a heap should one look for its smallest element?,7,0.835656345,1,0.616306,1,1
Deleting an arbitrary element of a heap can be done by generalizing the algorithm for deleting its root.,17,0.20908447,0.627448806,0.375206,5,2
"Fill in a table with the time efficiency classes of efficient implementations of the three operations: finding the largest element, finding and deleting the largest element, and adding a new element. ",15,0.317881066,0.189643498,0.314033,3,2
"As a rule, sorting algorithms that can exchange far-apart elements are not stable. ",15,0.525801881,0.401831157,0.609389,3,2
Set up sums and simplify them by using the standard formulas and rules for sum manipulation. Do not forget to include the multiplications outside the inner loop.,14,0.972405694,0.713449112,0.543101,2,2
Check the algorithm's pseudocode to see what it does upon encountering equal values.,14,0.386516635,0.501556999,0.489183,2,2
Trace the algorithm on the input given,14,0.096412296,0.733466668,0.413716,2,2
Check whether the algorithm can reverse a relative ordering of equal elements.,9,0.145549474,0.436901096,0.446654,3,1
Where will A[i] be in the sorted array?,9,0.232774545,1,0.465184,3,1
Take advantage of the standard traversals of such trees.,2,0.28582794,0.338960137,0.603205,2,0
"Follow the definitions of the arrays B and C in the description of the method. b. Find, say, B[C[3]] for the example in part (a). ",3,0.191093763,0.299656361,0.499801,3,0
Start by finding the target positions for all the statures.,14,0.207757209,0.751202566,0.592427,2,2
Use linked lists to hold nonzero elements of the matrices.,8,0.243863416,0.341089211,0.662278,2,1
Represent each of the given polynomials by a linked list with nodes containing exponent i and coefficient ai for each nonzero term aixi.,14,0.363840827,0.322065594,0.47358,2,2
Trace the algorithm in the same way it is done in the section for another instance of the string-matching problem.,9,0.267575991,0.445312462,0.644653,3,1
Thinking about searching for information should lead to a variety of examples.,1,0.179788305,0.261191266,0.5485,1,0
"Use the standard rules of sum manipulation and, in particular, the geometric series formula. b. You will need to take logarithms base m/2 in your derivation. ",14,0.572344022,0.209815949,0.613249,2,2
Find this value from the inequality in the text that provides the upper-bound of the B-tree's height.,8,0.435663847,0.204568866,0.801134,2,1
Follow the insertion algorithm outlined in the section.,1,0.211278337,0.406873327,0.6681,1,0
"Just follow the description of the algorithm given in the statement of the problem. Note that a new key is always inserted in a leaf and that full nodes are always split on the way down, even though the leaf for the new key may have a room for it. b. Can a split of a full node cause a cascade of splits through the chain of its ancestors? Can we get a taller search tree than necessary?",9,0.972018795,0.663177506,0.793809,3,1
Compare the definitions of the two techniques.,1,0.220979907,0.25,0.683887,1,0
Use the table generated by the dynamic programming algorithm in solving the problem's instance in Example 1 of the section.,14,0.683779128,0.172075286,0.740515,2,2
Apply the dynamic programming algorithm to the instance given as it is done in Example 2 of the section. Note that there are two optimal coin combinations here.,14,0.838335583,0.265429847,0.612913,2,2
The algorithm's time efficiency can be investigated by following the standard plan of analyzing the time efficiency of a nonrecursive algorithm. b. How much space do the two tables generated by the algorithm use?,9,0.859607742,0.418990606,0.594411,3,1
Use a space-for-time trade-off.,2,0.547072358,0.25,0,2,0
"If the assertion were true, would we not have a simpler algorithm for constructing an optimal binary search tree? ",10,0.757148948,0.454299581,0.717918,4,1
The structure of the tree should simply minimize the average depth of its nodes. Do not forget to indicate a way to distribute the keys among the nodes of the tree.,8,0.556567148,0.365635377,0.780336,2,1
Consider all the possibilities of partitioning the nodes between the left and right subtrees. b. Compute the values in question using the two formulas. c. Use the formula for the nth Catalan number and Stirling's formula for n!. ,14,0.506353783,0.186963398,0.410277,2,2
Change the bounds of the innermost loop of algorithm OptimalBST by exploiting the monotonicity of the root table mentioned at the end of the section.,14,0.245227816,0.482142634,0.523532,2,2
"Considering the case of two jobs might help. Of course, after forming a hypothesis, you will have to prove the algorithm's optimality for an arbitrary input or find a specific counterexample showing that it is not the case. ",11,0.750882723,0.281463448,0.588304,5,1
Simply apply the greedy approach to the situation at hand. You may assume that t1 t2 . . . tn.,8,0.676976493,0.330674885,0.708854,2,1
"Trace the algorithm for the graph given. An example can be found in the text. b. After the next fringe vertex is added to the tree, add all the unseen vertices adjacent to it to the priority queue of fringe vertices. ",13,0.907717755,0.752244875,0.710196,1,2
Applying Prim's algorithm to a weighted graph that is not connected should help in answering this question.,8,0.698946662,0.300699147,0.766921,2,1
Check whether the proof of the algorithm's correctness is valid for negative edge weights.,3,0.963533276,0.209986716,0.800876,3,0
The answer is no. Give a counterexample.,4,0.212407333,0.5,0.579795,4,0
"Since Prim's algorithm needs weights on a graph's edges, some weights have to be assigned. As to the second question, think of other algorithms that can solve this problem. ",7,0.351399911,0.412501996,0.689782,1,1
"After combining the two nodes with the lowest probabilities, resolve the tie arising on the next iteration in two different ways. For each of the two Huffman codes obtained, compute the mean and variance of the codeword length. ",14,0.98285376,0.270119255,0.790973,2,2
The maximal length of a codeword relates to the height of Huffman's coding tree in an obvious fashion. Try to find a set of n specific frequencies for an alphabet of size n for which the tree has the shape yielding the longest codeword possible.,14,0.740241744,0.33438094,0.738185,2,2
"What is the most appropriate data structure for an algorithm whose principal operation is finding the two smallest elements in a given set and replacing them by their sum? b. Identify the principal operations of the algorithm, the number of times they are executed, and their efficiencies for the data structure used. ",7,0.28572913,0.327266345,0.579044,1,1
"Maintain two queues: one for given frequencies, the other for weights of new trees. ",14,0.302056889,0.334375826,0.426616,2,2
Generate the codewords right to left.,14,0.658830871,0.658016446,0.619643,2,2
See an application of this algorithm to another bipartite graph in the section.,9,0.636852544,0.463484572,0.619919,3,1
The definition of a matching and its cardinality should lead you to the answers to these questions with no difficulty.,14,0.250670318,0.136004161,0.720551,2,2
"You do not have to check the inequality for each subset S of V if you can point out a subset for which the inequality does not hold. Otherwise, fill in a table for all the subsets S of the indicated set V with columns for S, R(S), and |R(S)| |S|. b. Think time efficiency. ",16,0.222705448,0.270869777,0.504098,4,2
Reduce the problem to finding a maximum matching in a bipartite graph.,8,0.999200983,0.473665591,0.867832,2,1
Transform a given bipartite graph into a network by making vertices of the former be intermediate vertices of the latter.,7,0.935368094,0.377520439,0.778528,1,1
"Since this greedy algorithm is arguably simpler than the augmenting-path algorithm given in the section, should we expect a positive or negative answer? Of course, this point cannot be substituted for a more specific argument or a counterexample. ",10,0.503879589,0.130784569,0.633563,4,1
Prove first that 2h l by induction on h. b. Prove first that 3h l by induction on h.,14,0.283445694,0.427728385,0.507336,2,2
"How many outcomes does the problem have? b. Of course, there are many ways to solve this simple problem. c. Thinking about a, b, and c as points on the real line should help. ",9,0.795397531,0.283105522,0.539652,3,1
"This is a straightforward question. You may assume that the three elements to be sorted are distinct. (If you need help, see decision trees for the threeelement selection sort and three-element insertion sort in the section.) ",2,0.262013334,0.237647971,0.715423,2,0
Compute a nontrivial lower bound for sorting a four-element array and then identify a sorting algorithm whose number of comparisons in the worst case matches the lower bound.,10,0.402778371,0.311147576,0.576458,4,1
This is not an easy task. None of the standard sorting algorithms can do this. Try to design a special algorithm that squeezes as much information as possible from each of its comparisons.,23,0.198456522,0.267345413,0.542818,5,3
This is a very straightforward question. Use the obvious observation that sequential search in a sorted list can be stopped as soon as an element larger than the search key is encountered.,1,0.166261586,0.431805914,0.854179,1,0
Start by transforming the logarithms to the same base. b. The easiest way is to prove that lim log2(n + 1) >,16,0.387836964,0.427450999,0.84509,4,2
"As the given definition of the number of significant digits requires, compute the relative errors of the approximations. One of the answers doesn't agree with our intuitive idea of this notion. ",10,0.817475539,0.273990354,0.73534,4,1
Use the definitions of the absolute and relative errors and the properties of the absolute value.,0,0.974221106,0.317660767,0.704315,0,0
Apply the formula for the area of a trapezoid to each of the n approximating trapezoid strips and sum them up.,0,0.959834609,0.437358703,0.478816,0,0
Find an upper bound for the second derivative of esin x and use formula (,10,0.240457093,0.522556457,0.496586,4,1
"Consider all possible values for the coefficients a, b, and c. Keep in mind that solving an equation means finding all its roots or proving that no roots exist. ",14,0.813225546,0.203943134,0.86487,2,2
"Prove that every element xn of the sequence is (i) positive, (ii) greater than D (by computing xn+1 - D), and (iii) decreasing (by computing xn+1 - xn). Then take the limit of both sides of equality (",16,0.306926599,0.290688882,0.638832,4,2
What operations does a best-first branch-and-bound algorithm perform on the live nodes of its state-space tree?,7,0.651029892,0.441661145,0.552703,1,1
"Use the smallest numbers selected from the columns of the cost matrix to compute the lower bounds. With this bounding function, it's more logical to consider four ways to assign job 1 for the nodes on the first level of the tree. ",8,0.999261978,0.370026174,0.638687,2,1
Your answer should be an n _ n matrix with a simple structure making the algorithm work the fastest. b. Sketch the structure of the state-space tree for your answer to part (a).,11,0.175122942,0.252544499,0.487232,5,1
Start by marking the first column of the matrix and finding the smallest element in the first row and an unmarked column. b. You will have to find an optimal solution by exhaustive search or by a branch-and-bound algorithm or by some other method.,15,0.964586575,0.243693889,0.477526,3,2
"The simplest approach is to mark matrix columns that correspond to visited cities. Alternatively, you can maintain a linked list of unvisited cities. b. Following the standard plan for analyzing algorithm efficiency should pose no difficulty (and yield the same result for either of the two options mentioned in the hint to part (a)). ",14,0.552116846,0.12523332,0.406027,2,2
Extend the triangle inequality to the case of k 1 intermediate vertices and prove its validity by mathematical induction.,9,0.102720288,0.226325028,0.539282,3,1
"First, determine the time efficiency of each of the three steps of the algorithm. ",9,0.241088662,0.53230472,0.397366,3,1
"You will have to prove two facts: i. f (s) 2f (sa) for any instance of the knapsack problem, where f (sa) is the value of the approximate solution obtained by the enhanced greedy algorithm and f (s) is the optimal value of the exact solution to the same instance. ii. The smallest constant for which such an assertion is true is ",9,0.579692498,0.386556871,0.609134,3,1
Do the walk in the opposite direction.,14,0.23923966,0.55789209,0.837797,2,2
"Use the property underlying the bisection method. b. Use the definition of division of polynomial p(x) by x - x0, i.e., the equality p(x) = q(x)(x - x0) + r, where x0 is a root of p(x), q(x) and r are the quotient and remainder of this division, respectively. c. Differentiate both sides of the equality given in part (b) and substitute x0 in the result. ",14,0.395354704,0.347059733,0.550628,2,2
"Use the fact that |xn - x| is the distance between xn, the middle of interval [an, bn], and root x. ",2,0.980038556,0.585777094,0.727326,2,0
Sketch the graph to determine a general location of the root and choose an initial interval bracketing it. Use an appropriate inequality given in Section,14,0.27110758,0.321168059,0.66913,2,2
"Write an equation of the line through the points (an, f (an)) and (bn, f (bn)) and find its x-intercept. ",8,0.175386317,0.616254441,0.537832,2,1
"Write an equation of the tangent line to the graph of the function at (xn, f (xn)) and find its x-intercept. ",8,0.445891927,0.318966107,0.478003,2,1
