Questions,Manual Label,Gaussian,Linear,Polynomial,RBF
Explain what adjustments if any need to be made in Dijkstra's algorithm and/or in an underlying graph to solve the following problems. a. Solve the single-source shortest-paths problem for directed weighted graphs. b. Find a shortest path between two given vertices of a weighted graph or digraph. (This variation is called the single-pair shortest-path problem.) c. Find the shortest paths to a given vertex from each other vertex of a weighted graph or digraph. (This variation is called the single-destination shortest-paths problem.) d. Solve the single-source shortest-paths problem in a graph with nonnegative numbers assigned to its vertices (and the length of a path defined as the sum of the vertex numbers on the path).,Conceptual,Procedural,Factual,Conceptual,Factual
"Solve the following linear programming problems geometrically. a. maximize 3x + y subject to -x + y 1 2x + y 4 x 0, y 0 b. maximize x + 2y subject to 4x y y 3+x x 0, y 0 ",Conceptual,Conceptual,Conceptual,Conceptual,Procedural
Does the maximum-flow problem always have a unique solution? Would your answer be different for networks with different capacities on all their edges? b. Answer the same questions for the minimum-cut problem of finding a cut of the smallest capacity in a given network.,Conceptual,Factual,Factual,Conceptual,Procedural
Explain how the maximum-flow problem for a network with several sources and sinks can be transformed into the same problem for a network with a single source and a single sink. b. Some networks have capacity constraints on the flow amounts that can flow through their intermediate vertices. Explain how the maximum-flow problem for such a network can be transformed to the maximum-flow problem for a network with edge capacity constraints only.,Conceptual,Procedural,Conceptual,Conceptual,Procedural
Consider the problem of identifying a lighter fake coin among n identicallooking coins with the help of a balance scale. Can we use the same information-theoretic argument as the one in the text for the number of questions in the guessing game to conclude that any algorithm for identifying the fake will need at least log2 n weighings in the worst case?,Factual,Conceptual,Procedural,Conceptual,Procedural
Prove by mathematical induction that a. h log2 l for any binary tree with height h and the number of leaves l. b. h log3 l for any ternary tree with height h and the number of leaves l.,Factual,Factual,Factual,Conceptual,Factual
"Some textbooks define the number of significant digits in the approximation of number by number as the largest nonnegative integer k for which | - | < 5 . 10-k. || According to this definition, how many significant digits are there in the approximation of by a. ",Factual,Procedural,Procedural,Conceptual,Factual
"Prove that if p(x) is a polynomial of an odd degree, then it must have at least one real root. b. Prove that if x0 is a root of an n-degree polynomial p(x), the polynomial can be factored into p(x) = (x - x0)q(x), where q(x) is a polynomial of degree n - 1",Conceptual,Conceptual,Procedural,Conceptual,Procedural
"One can find arguments supporting either view. There is a well-established principle pertinent to the matter, though: scientific facts or mathematical expressions of them are not patentable. (Why do you think this is the case?) But should this preclude granting patents for all algorithms? ",Conceptual,Factual,Procedural,Conceptual,Factual
"Prove that if d divides both m and n (i.e., m = sd and n = td for some positive integers s and t), then it also divides both n and r = m mod n and vice versa. Use the formula m = qn + r (0 r < n) and the fact that if d divides two integers u and v, it also divides u + v and u - v (why?). ",Conceptual,Procedural,Conceptual,Conceptual,Factual
"For a sorted array, there is a spectacularly efficient algorithm you almost certainly have heard about. b. Unsuccessful searches can be made faster. ",Conceptual,Factual,Conceptual,Conceptual,Procedural
"Prove the correctness of (a), (b), and (c) by using the appropriate definitions; construct a counterexample for (d) (e.g., by constructing two functions behaving differently for odd and even values of their arguments). ",Conceptual,Procedural,Conceptual,Conceptual,Procedural
Check how fast the count values grow with doubling the input size.,Conceptual,Conceptual,Procedural,Conceptual,Procedural
Compare the values of the functions lg lg n and lg n for n = 2k.,Conceptual,Procedural,Procedural,Conceptual,Procedural
"Get the empirical data for random values of n in a range of, say, between 102 and 104 or 105 and plot the data obtained. (You may want to use different scales for the axes of your coordinate system.)",Conceptual,Conceptual,Procedural,Conceptual,Procedural
Solving the problem for n = 2 and n = 3 should lead you to the critical insight. b. Where would you put the post office if it did not have to be at one of the village locations?,Conceptual,Procedural,Procedural,Conceptual,Factual
"Check requirements (i)_(iii) by using basic properties of absolute values. b. For the Manhattan distance, the points in question are defined by the equation |x - 0| + |y - 0| = ",Conceptual,Procedural,Factual,Conceptual,Factual
Represent the disk movements by flipping bits in a binary n-tuple.,Conceptual,Conceptual,Procedural,Conceptual,Factual
Take logarithms of both sides of the equality. b. What did we use the closed-form formula for?,Conceptual,Conceptual,Procedural,Conceptual,Factual
What structure does a complete tree of height h with the largest number of nodes have? What about a complete tree with the smallest number of nodes? b. Use the results established in part (a).,Factual,Procedural,Procedural,Conceptual,Procedural
Take advantage of the standard traversals of such trees.,Conceptual,Factual,Procedural,Conceptual,Factual
"Follow the definitions of the arrays B and C in the description of the method. b. Find, say, B[C[3]] for the example in part (a). ",Conceptual,Factual,Procedural,Conceptual,Factual
Thinking about searching for information should lead to a variety of examples.,Conceptual,Procedural,Factual,Conceptual,Procedural
Follow the insertion algorithm outlined in the section.,Conceptual,Procedural,Procedural,Conceptual,Factual
Compare the definitions of the two techniques.,Factual,Factual,Factual,Conceptual,Procedural
Use a space-for-time trade-off.,Conceptual,Conceptual,Procedural,Conceptual,Procedural
Check whether the proof of the algorithm's correctness is valid for negative edge weights.,Conceptual,Procedural,Factual,Conceptual,Factual
The answer is no. Give a counterexample.,Factual,Procedural,Procedural,Conceptual,Factual
"This is a straightforward question. You may assume that the three elements to be sorted are distinct. (If you need help, see decision trees for the threeelement selection sort and three-element insertion sort in the section.) ",Factual,Procedural,Factual,Conceptual,Factual
This is not an easy task. None of the standard sorting algorithms can do this. Try to design a special algorithm that squeezes as much information as possible from each of its comparisons.,Factual,Factual,Factual,Conceptual,Procedural
This is a very straightforward question. Use the obvious observation that sequential search in a sorted list can be stopped as soon as an element larger than the search key is encountered.,Factual,Procedural,Procedural,Conceptual,Procedural
Use the definitions of the absolute and relative errors and the properties of the absolute value.,Factual,Factual,Conceptual,Conceptual,Procedural
Apply the formula for the area of a trapezoid to each of the n approximating trapezoid strips and sum them up.,Factual,Conceptual,Factual,Conceptual,Procedural
"Use the fact that |xn - x| is the distance between xn, the middle of interval [an, bn], and root x. ",Conceptual,Factual,Procedural,Conceptual,Factual
