Questions,Manual Label,NSQ,LDA,LSA,Cognitive
List and briefly define the four main elements of a computer.,0,0.715812497234,0.249360384072,0.487392,0
Define the two main categories of processor registers.,0,0.208936081892,0.375936394835,0.452785,0
"In general terms, what are the four distinct actions that a machine instruction can specify?",0,0.781664233078,0.360004526916,0.681999,0
What is an interrupt?,0,0.128615135946,0.0,0.0,0
How are multiple interrupts dealt with?,1,0.451719896727,0.312508008696,0.737284,1
What characteristics distinguish the various elements of a memory hierarchy?,1,0.69429030076,0.638621979273,0.490218,1
What is cache memory?,0,0.788315865834,0.299900892615,0.872958,0
What is the difference between a multiprocessor and a multicore system?,0,0.88953866175,0.411952225005,0.56552,0
What is the distinction between spatial locality and temporal locality?,1,0.977228973802,1.0,0.870521,1
"In general, what are the strategies for exploiting spatial locality and temporal locality?",7,0.869631788511,1.0,0.86518,1
What are three objectives of an OS design?,1,0.153569245519,0.764793755986,0.663461,1
What is the kernel of an OS?,0,0.784136533805,0.317698508005,0.506124,0
What is multiprogramming?,0,0.200871742012,0.0,0.0,0
What is a process?,0,0.171483740529,0.512417277302,0.762889,0
How is the execution context of a process used by the OS?,0,0.321804669244,0.354971314386,0.560156,0
List and briefly explain five storage management responsibilities of a typical OS.,1,0.596993061425,0.395727038865,0.480312,1
Explain the distinction between a real address and a virtual address.,0,0.652790925881,0.543968797525,0.703961,0
Describe the round-robin scheduling technique.,0,0.430854677686,0.601372805829,0.815443,0
Explain the difference between a monolithic kernel and a microkernel.,1,0.503098254914,0.531521223389,0.554006,1
What is multithreading?,0,0.203506721532,0.0,0.0,0
List the key design issues for an SMP operating system.,0,0.534830670863,0.764793755986,0.532448,0
What is an instruction trace?,0,0.300576365902,0.379837673501,0.753002,0
What common events lead to the creation of a process?,1,0.565680723705,0.302145391284,0.560454,1
"For the processing model of Figure 3.6, briefly define each state.",0,0.793505751367,0.658239227733,0.525814,0
What does it mean to preempt a process?,0,0.449939250569,0.261858418034,0.642942,0
What is swapping and what is its purpose?,6,0.770027699164,0.458223463846,0.479623,0
Why does Figure 3.9b have two blocked states?,7,0.364880779815,0.479912639689,0.646905,1
List four characteristics of a suspended process.,0,0.793130016129,0.260632566126,0.565751,0
For what types of entities does the OS maintain tables of information for management purposes?,7,0.652797162743,0.578118413166,0.778019,1
List three general categories of information in a process control block.,0,0.248186344216,0.36304199369,0.719271,0
Why are two modes (user and kernel) needed?,7,0.255531428256,0.479912639689,0.739519,1
What are the steps performed by an OS to create a new process?,12,0.189083665849,0.180936334942,0.572281,0
What is the difference between an interrupt and a trap?,0,0.25446546422,0.658239227733,0.453139,0
Give three examples of an interrupt.,0,0.14719282754,0.424606752297,0.535892,0
What is the difference between a mode switch and a process switch?,0,0.885053086448,0.479912639689,0.742987,0
"Table 3.5 lists typical elements found in a process control block for an unthreaded OS. Of these, which should belong to a thread control block and which should belong to a process control block for a multithreaded system?",7,0.522290903642,0.503312536084,0.542611,1
List reasons why a mode switch between threads may be cheaper than a mode switch between processes.,7,0.864448538597,1.0,0.57584,1
What are the two separate and potentially independent characteristics embodied in the concept of process?,7,0.361402986188,0.412503067575,0.492927,1
Give four general examples of the use of threads in a single-user multiprocessing system.,0,0.907121600947,0.446322731422,0.747361,0
What resources are typically shared by all of the threads of a process?,0,0.30014284532,0.451969149495,0.702309,0
List three advantages of ULTs over KLTs.,6,0.652919098381,1.0,0.714895,0
List two disadvantages of ULTs compared to KLTs.,6,0.942774906942,0.940834470212,0.674172,0
Define jacketing.,0,0.55848470786,0.403744612146,0.497941,0
List four design issues for which the concept of concurrency is relevant.,6,0.5421594791,0.364838494789,0.666886,0
What are three contexts in which concurrency arises?,6,0.551192195132,0.517911154175,0.697309,0
What is the basic requirement for the execution of concurrent processes?,0,0.28429812613,0.481112961135,0.705569,0
List three degrees of awareness between processes and briefly define each.,6,0.554384511253,0.40557049391,0.502019,0
What is the distinction between competing processes and cooperating processes?,0,0.60185937192,0.517911154175,0.616722,0
List the three control problems associated with competing processes and briefly de- fine each.,6,0.506416115429,0.517911154175,0.58109,0
List the requirements for mutual exclusion.,0,0.365255158688,0.422386127572,0.715189,0
What operations can be performed on a semaphore?,6,0.515046498944,0.517911154175,0.45015,0
Give examples of reusable and consumable resources.,0,0.475062608776,0.535578933537,0.705025,0
What are the three conditions that must be present for deadlock to be possible?,0,0.377333593956,0.757762636722,0.880292,0
What are the four conditions that create deadlock?,0,0.815182749869,0.298474915522,0.783907,0
How can the hold-and-wait condition be prevented?,6,0.957103875618,0.306104922889,0.634145,0
List two ways in which the no-preemption condition can be prevented.,6,0.950618509139,0.479038938967,0.69743,0
How can the circular wait condition be prevented?,6,0.378472117959,0.295446457175,0.620513,0
"What is the difference among deadlock avoidance, detection, and prevention?",6,0.762990178291,0.361577074826,0.920651,0
What requirements is memory management intended to satisfy?,7,0.191562338514,0.671623626056,0.804216,1
Why is the capability to relocate processes desirable?,6,0.491798898448,0.7493808821,0.546904,0
Why is it not possible to enforce memory protection at compile time?,6,0.29343263596,0.7493808821,0.708035,0
What are some reasons to allow two or more processes to all have access to a particular region of memory?,0,0.104134423352,0.7493808821,0.442544,0
"In a fixed-partitioning scheme, what are the advantages of using unequal-size partitions?",6,0.419761618073,0.7493808821,0.780746,0
What is the difference between internal and external fragmentation?,6,0.553175844778,0.7493808821,0.601119,0
"What are the distinctions among logical, relative, and physical addresses?",7,0.612010960505,0.7493808821,0.867763,1
What is the difference between a page and a frame?,0,0.49590453827,0.7493808821,0.794616,0
What is the difference between a page and a segment?,0,0.582310548953,0.7493808821,0.820498,0
What is the difference between simple paging and virtual memory paging?,6,0.368560212196,0.317347039543,0.857547,0
Explain thrashing.,6,0.401133764398,0.379912431278,0.655267,0
Why is the principle of locality crucial to the use of virtual memory?,7,0.827912953875,0.379912431278,0.602839,1
What elements are typically found in a page table entry? Briefly define each element.,6,0.311733698828,0.379912431278,0.728566,0
What is the purpose of a translation lookaside buffer?,6,0.521132978536,0.379912431278,0.647134,0
Briefly define the alternative page fetch policies.,7,0.458148368375,0.379912431278,0.748237,1
What is the difference between resident set management and page replacement policy?,6,0.581744856469,0.209399695189,0.844302,0
What is the relationship between FIFO and clock page replacement algorithms?,13,0.796254095893,0.367605043495,0.838989,1
What is accomplished by page buffering?,7,0.620900557277,0.379912431278,0.813244,1
Why is it not possible to combine a global replacement policy and a fixed allocation policy?,7,0.991874273812,0.216014253738,0.545676,1
What is the difference between a resident set and a working set?,6,0.482486291141,0.23421801017,0.557648,0
What is the difference between demand cleaning and precleaning?,6,0.518329235491,0.379912431278,0.697164,0
Briefly describe the three types of processor scheduling.,6,0.337622421347,0.309824657341,0.712608,0
What is usually the critical performance requirement in an interactive operating system?,0,0.274514546553,0.658239227733,0.61715,0
What is the difference between turnaround time and response time?,0,0.517067162289,0.658239227733,0.748348,0
"For process scheduling, does a low-priority value represent a low priority or a high priority?",0,0.814319819349,0.658239227733,0.528274,0
What is the difference between preemptive and nonpreemptive scheduling?,6,0.324739281879,0.658239227733,0.618776,0
Briefly define FCFS scheduling.,6,0.608275323493,0.658239227733,0.749415,0
Briefly define round-robin scheduling.,6,0.531668557244,0.658239227733,0.748528,0
Briefly define shortest-process-next scheduling.,6,0.625625721749,0.658239227733,0.747942,0
Briefly define shortest-remaining-time scheduling.,6,0.676686897247,0.658239227733,0.747418,0
Briefly define highest-response-ratio-next scheduling.,6,0.616896843123,0.658239227733,0.747418,0
Briefly define feedback scheduling.,6,0.522602639999,0.658239227733,0.743783,0
List and briefly define five different categories of synchronization granularity.,6,0.646287918615,0.211137776909,0.499599,0
List and briefly define four techniques for thread scheduling.,6,0.957924977811,0.505224310739,0.591577,0
List and briefly define three versions of load sharing.,6,0.752071427321,0.379912431278,0.522607,0
What is the difference between hard and soft real-time tasks?,6,0.936495164928,0.210579562054,0.789939,0
What is the difference between periodic and aperiodic real-time tasks?,6,0.975898734793,0.270621945123,0.861529,0
List and briefly define five general areas of requirements for a real-time operating system.,0,0.523885262994,0.276846249493,0.618941,0
List and briefly define four classes of real-time scheduling algorithms.,6,0.501275111444,0.459515286829,0.664202,0
What items of information about a task might be useful in real-time scheduling?,7,0.860345567637,0.352367342881,0.79812,1
List and briefly define three techniques for performing I/O.,6,0.327784233022,0.418467846064,0.510754,0
What is the difference between logical I/O and device I/O?,6,0.236653616386,0.937974404519,0.745562,0
What is the difference between block-oriented devices and stream-oriented devices? Give a few examples of each.,0,0.468677270649,0.496274823507,0.632883,0
Why would you expect improved performance using a double buffer rather than a single buffer for I/O?,9,0.266922804149,0.355469654965,0.641155,3
What delay elements are involved in a disk read or write?,7,0.313717031086,0.40961232175,0.704512,1
Briefly define the disk scheduling policies illustrated in Figure 11.7.,1,0.421955183154,0.305749954125,0.595556,1
Briefly define the seven RAID levels.,1,0.572760087667,0.377522525274,0.84434,1
What is the typical disk sector size?,1,0.485348161532,0.63066211781,0.64855,1
What is the difference between a field and a record?,1,0.342108786989,0.217693934569,0.696792,1
What is the difference between a file and a database?,1,0.365728147999,0.379912431278,0.453139,1
What is a file management system?,1,0.184608722865,0.946701830711,0.513086,1
What criteria are important in choosing a file organization?,9,0.344046604605,0.32306480191,0.623756,3
List and briefly define five file organizations.,0,0.75396859324,0.426432732514,0.566061,0
Why is the average search time to find a record in a file less for an indexed sequential file than for a sequential file?,10,0.508861254938,0.426564504331,0.928889,4
What are typical operations that may be performed on a directory?,0,0.906178473374,0.437476180891,0.569252,0
What is the relationship between a pathname and a working directory?,1,0.961831147969,0.360293527791,0.623568,1
What are typical access rights that may be granted or denied to a particular user for a particular file?,0,0.568831702846,0.312532880284,0.786788,0
List and briefly define three blocking methods.,0,0.686279017906,0.375292964921,0.537632,0
List and briefly define three file allocation methods.,0,0.267511496414,0.402636553385,0.623538,0
What is an embedded system?,0,0.43456248528,0.486310649004,0.895736,0
What are some typical requirements or constraints on embedded systems?,1,0.491874100284,0.222757308226,0.87097,1
What is an embedded OS?,0,0.608907039851,0.22094198398,0.881229,0
What are some of the key characteristics of an embedded OS?,0,0.545888307917,0.301444578702,0.861838,0
Explain the relative advantages and disadvantages of an embedded OS based on an existing commercial OS compared to a purpose-built embedded OS.,10,0.657347087527,0.766091685911,0.864354,4
What are the principal objectives that guided the design of the eCos kernel?,1,0.510083184733,0.609997165839,0.709178,1
"In eCos, what is the difference between an interrupt service routine and a deferred service routine?",0,0.686319452664,0.25078905472,0.713958,0
What concurrency mechanisms are available in eCos?,0,0.466864983719,0.831469611982,0.682892,0
What is the target application for TinyOS?,0,0.986620214717,0.318180626563,0.475148,0
What are the design goals for TinyOS?,0,0.428314451325,0.454133385855,0.669769,0
What is a TinyOS component?,0,0.843819357801,1.0,0.768694,0
What software comprises the TinyOS operating system?,0,0.705478694611,0.454133385855,0.688595,0
What is the default scheduling discipline for TinyOS?,0,0.519211293486,0.335620812123,0.731374,0
Define computer security.,0,0.493825419721,0.295021978165,0.594626,0
What are the fundamental requirements addressed by computer security?,1,0.262588556598,1.0,0.47673,1
What is the difference between passive and active security threats?,0,0.613098010521,1.0,0.625382,0
List and briefly define three classes of intruders.,0,0.368652692608,0.588362808171,0.529868,0
List and briefly define three intruder behavior patterns.,0,0.823050095641,1.0,0.536909,0
What is the role of compression in the operation of a virus?,9,0.6059318583,1.0,0.643749,3
What is the role of encryption in the operation of a virus?,9,0.567234641523,1.0,0.624169,3
What are typical phases of operation of a virus or worm?,0,0.422047150723,1.0,0.78692,0
"In general terms, how does a worm propagate?",7,0.73976518975,1.0,0.591133,1
What is the difference between a bot and a rootkit?,0,0.527638041753,0.518289394046,0.533189,0
"In general terms, what are four means of authenticating a user’s identity?",1,0.228182651603,0.484904231726,0.532664,1
Explain the purpose of the salt in Figure 15.1.,1,0.707949259799,0.509333019563,0.822577,1
Explain the difference between a simple memory card and a smart card.,1,0.483291486275,0.353722543802,0.598649,1
List and briefly describe the principal physical characteristics used for biometric identification.,0,0.659565429368,0.484904231726,0.432744,0
Briefly describe the difference between DAC and RBAC.,0,0.676699410488,0.484904231726,0.500347,0
Explain the difference between anomaly intrusion detection and signature intrusion detection.,0,0.596534499769,0.484904231726,0.739929,0
What is a digital immune system?,0,0.556672329812,0.484904231726,0.578477,0
How does behavior-blocking software work?,7,0.552609673539,0.484904231726,0.566719,1
Describe some worm countermeasures.,0,0.503896278232,0.409544552998,0.748628,0
What types of programming languages are vulnerable to buffer overflows?,7,0.806302944869,0.448399627289,0.50045,1
What are the two broad categories of defenses against buffer overflows?,0,0.575746269914,0.484904231726,0.507168,0
List and briefly describe some of the defenses against buffer overflows that can be used when compiling new programs.,0,0.510362225436,0.484904231726,0.487273,0
"List and briefly describe some of the defenses against buffer overflows that can be implemented when running existing, vulnerable programs.",0,0.402893312466,0.484904231726,0.481276,0
What is client/server computing?,0,0.963314141693,0.80610629307,0.913358,0
What distinguishes client/server computing from any other form of distributed data processing?,7,0.811698416374,0.45857606603,0.890351,1
What is the role of a communications architecture such as TCP/IP in a client/server environment?,7,0.83365215532,0.552854329776,0.787051,1
"Discuss the rationale for locating applications on the client, the server, or split between client and server.",10,0.502971313974,0.522325879957,0.766245,4
"What are fat clients and thin clients, and what are the differences in philosophy of the two approaches?",6,0.803460116927,0.206430081834,0.506844,0
Suggest pros and cons for fat client and thin client strategies.,1,0.86434455111,0.342269044308,0.771401,1
Explain the rationale behind the three-tier client/server architecture.,4,0.67052555971,0.585231794144,0.874103,4
What is middleware?,0,0.523099554678,0.0,0.0,0
"Because we have standards such as TCP/IP, why is middleware needed?",1,0.786293856365,0.161980258619,0.661492,1
List some benefits and disadvantages of blocking and nonblocking primitives for message passing.,6,0.305214230355,0.57194648572,0.836397,0
List some benefits and disadvantages of nonpersistent and persistent binding for RPCs.,6,0.588748097752,0.427007191371,0.806305,0
List some benefits and disadvantages of synchronous and asynchronous RPCs.,6,0.798228208085,0.424373566563,0.739154,0
List and briefly define four different clustering methods.,0,0.676405842009,0.314082952235,0.552009,0
"Suppose the hypothetical processor of Figure 1.3 also has two I/O instructions: 0011 Load AC from I/O and 0111 Store AC to I/O. In these cases, the 12-bit address identifies a particular external device. Show the program execution for the following program",13,0.294268990179,0.248239803788,0.669425,1
The program execution is described in the text using six steps. Expand this description to show the use of the MAR and MBR.,13,0.959278451742,0.362418988809,0.593137,1
Consider a hypothetical 32-bit microprocessor having 32-bit instructions composed of two fields. The first byte contains the opcode and the remainder an immediate operand or an operand address. What is the maximum directly addressable memory capacity (in bytes)?,9,0.947364815243,0.694544161353,0.613033,3
"Discuss the impact on the system speed if the microprocessor bus has - 1. a 32-bit local address bus and a 16-bit local data bus, or 2. a 16-bit local address bus and a 16-bit local data bus.",9,0.994395378498,0.621851383786,0.491587,3
Consider a hypothetical 32-bit microprocessor having 32-bit instructions composed of two fields. How many bits are needed for the program counter and the instruction register?,8,0.92931191365,1.0,0.712706,2
Consider a hypothetical microprocessor generating a 16-bit address and having a 16-bit data bus. What is the maximum memory address space that the processor can access directly if it is connected to a “16-bit memory”?,8,0.908707695676,0.771063413707,0.465993,2
Consider a hypothetical microprocessor generating a 16-bit address and having a 16-bit data bus. What is the maximum memory address space that the processor can access directly if it is connected to an “8-bit memory”?,8,0.908707695676,0.776157501939,0.465993,2
Consider a hypothetical microprocessor generating a 16-bit address and having a 16-bit data bus. What architectural features will allow this microprocessor to access a separate “I/O space”?,8,0.977203217548,1.0,0.580644,2
"Consider a hypothetical microprocessor generating a 16-bit address and having a 16-bit data bus. If an input and an output instruction can specify an 8-bit I/O port number, how many 8-bit I/O ports can the microprocessor support? How many 16-bit I/O ports? Explain.",8,0.979740874458,0.690560828499,0.572699,2
"Consider a 32-bit microprocessor, with a 16-bit external data bus, driven by an 8-MHz input clock. What is the maximum data transfer rate across the bus that this microprocessor can sustain in bytes/s?",8,0.995789648371,1.0,0.574139,2
"Consider a 32-bit microprocessor, with a 16-bit external data bus, driven by an 8-MHz input clock. To increase its performance, would it be better to make its external data bus 32 bits or to double the external clock frequency supplied to the microprocessor?",10,0.961203012521,1.0,0.521338,4
"Consider a computer system that contains an I/O module controlling a simple keyboard/printer Teletype. The following registers are contained in the CPU and connected directly to the system bus: Input Register(8), Output Register(8), Input Flag(1), Output Flag(1), and Interrupt Enable(1). The Teletype is able to encode an alphanumeric symbol to an 8-bit word and decode an 8-bit word into an alphanumeric symbol. The Input flag is set when an 8-bit word enters the input register from the Teletype. The Output flag is set when a word is printed. Describe how the CPU, using the first four registers listed in this problem, can achieve I/O with the Teletype. Describe how the function can be performed more efficiently by also employing IEN.",17,0.998051059559,0.987439998937,0.517393,5
"In virtually all systems that include DMA modules, DMA access to main memory is given higher priority than processor access to main memory. Why?",9,0.525284574602,0.266148981137,0.766851,3
A DMA module is transferring characters to main memory from an external device transmitting at 9600 bits per second (bps). The processor can fetch instructions at the rate of 1 million instructions per second. By how much will the processor be slowed down due to the DMA activity?,8,0.81806017917,0.529402205203,0.8715,2
"A computer consists of a CPU and an I/O device D connected to main memory M via a shared bus with a data bus width of one word. The CPU can execute a maximum of 106 instructions per second. An average instruction requires five processor cycles, three of which use the memory bus. A memory read or write operation uses one processor cycle. Suppose that the CPU is continuously executing “background” programs that require 95% of its instruction execution rate but not any I/O instructions. Assume that one processor cycle equals one bus cycle. Now suppose that very large blocks of data are to be transferred between M and D. a. If programmed I/O is used and each one-word I/O transfer requires the CPU to execute two instructions, estimate the maximum I/O data transfer rate, in words per second, possible through D. b. Estimate the same rate if DMA transfer is used.",8,0.847857028653,0.329663963301,0.645683,2
Consider the following code <CODE> a. Give one example of the spatial locality in the code. b. Give one example of the temporal locality in the code.,7,0.985874617747,0.662851003885,0.778415,1
"Consider a memory system with the following parameters: Tc   100 ns Cc   0.01 cents/bit Tm   1,200 ns Cm   0.001 cents/bit a. What is the cost of 1 MByte of main memory? b. What is the cost of 1 MByte of main memory using cache memory technology?",2,0.986049998024,1.0,0.620668,2
"Consider a memory system with the following parameters: Tc   100 ns Cc   0.01 cents/bit Tm   1,200 ns Cm   0.001 cents/bit. If the effective access time is 10% greater than the cache access time, what is the hit ratio H?",8,0.9856740049,1.0,0.814717,2
"A computer has a cache, main memory, and a disk used for virtual memory. If a referenced word is in the cache, 20 ns are required to access it. If it is in main memory but not in the cache, 60 ns are needed to load it into the cache (this includes the time to originally check the cache), and then the reference is started again. If the word is not in main memory, 12 ms are required to fetch the word from disk, followed by 60 ns to copy it to the cache, and then the reference is started again. The cache hit ratio is 0.9 and the main-memory hit ratio is 0.6. What is the average time in ns required to access a referenced word on this system?",8,0.744335233279,0.40943893766,0.731463,2
Suppose a stack is to be used by the processor to manage procedure calls and returns. Can the program counter be eliminated by using the top of the stack as a program counter?,9,0.816088642496,0.515960771152,0.455817,3
"Suppose that we have a multiprogrammed computer in which each job has identical characteristics. In one computation period, T, for a job, half the time is spent in I/O and the other half in processor activity. Each job runs for a total of N periods. Assume that a simple round-robin scheduling is used, and that I/O operations can overlap with processor operation. Define the following quantities: • Turnaround time = actual time to complete a job • Throughput = average number of jobs completed per time period T • Processor utilization = percentage of time that the processor is active (not waiting) Compute these quantities for one, two, and four simultaneous jobs, assuming that the period T is distributed in each of the following ways: a. I/O first half, processor second half b. I/O first and fourth quarters, processor second and third quarter",14,0.878994013229,0.241800399007,0.450558,2
"An I/O-bound program is one that, if run alone, would spend more time waiting for I/O than using the processor. A processor-bound program is the opposite. Suppose a short-term scheduling algorithm favors those programs that have used little processor time in the recent past. Explain why this algorithm favors I/O-bound programs and yet does not permanently deny processor time to processor-bound programs.",10,0.746531997236,0.261722164127,0.585615,4
