Questions,Manual Label,NSQ,LDA,LSA,Cognitive
Contrast the scheduling policies you might use when trying to optimize a time-sharing system with those you would use to optimize a multiprogrammed batch system.,10,0.424726088536,0.341320881198,0.667913,4
"What is the purpose of system calls, and how do system calls relate to the OS and to the concept of dual-mode (kernel-mode and user-mode) operation?",7,0.985868512418,0.262419038538,0.592543,1
"In IBM’s mainframe OS, OS/390, one of the major modules in the kernel is the System Resource Manager. This module is responsible for the allocation of resources among address spaces (processes). This problem concerns one example of SRM activity. Real memory is divided into equal-sized blocks called frames, of which there may be many thousands. Each frame can hold a block of virtual memory referred to as a page. SRM receives control approximately 20 times per second and inspects each and every page frame. If the page has not been referenced or changed, a counter is incremented by 1. Over time, SRM averages these numbers to determine the average number of seconds that a page frame in the system goes untouched. What might be the purpose of this and what action might SRM take?",9,0.964858087605,0.259955485026,0.697881,3
"A multiprocessor with eight processors has 20 attached tape drives. There is a large number of jobs submitted to the system that each require a maximum of four tape drives to complete execution. Assume that each job starts running with only three tape drives for a long period before requiring the fourth tape drive for a short period toward the end of its operation. Also assume an endless supply of such jobs. Assume the scheduler in the OS will not start a job unless there are four tape drives available. When a job is started, four drives are assigned immediately and are not released until the job finishes. What is the maximum number of jobs that can be in progress at once? What are the maximum and minimum number of tape drives that may be left idle as a result of this policy?",15,0.968731081548,0.418558422455,0.555757,3
A multiprocessor with eight processors has 20 attached tape drives. There is a large number of jobs submitted to the system that each require a maximum of four tape drives to complete execution. Assume that each job starts running with only three tape drives for a long period before requiring the fourth tape drive for a short period toward the end of its operation. Also assume an endless supply of such jobs. Suggest an alternative policy to improve tape drive utilization and at the same time avoid system deadlock. What is the maximum number of jobs that can be in progress at once? What are the bounds on the number of idling tape drives?,17,0.989476358686,0.421770123255,0.574751,5
"The following state transition table is a simplified model of process management, with the labels representing transitions between states of READY, RUN, BLOCKED, and NONRESIDENT. Give an example of an event that can cause each of the above transitions. Draw a diagram if that helps.",9,0.960922253943,0.479912639689,0.82401,3
"Assume that at time 5 no system resources are being used except for the processor and memory. Now consider the following events: At time 5: P1 executes a command to read from disk unit 3. At time 15: P5’s time slice expires. At time 18: P7 executes a command to write to disk unit 3. At time 20: P3 executes a command to read from disk unit 2. At time 24: P5 executes a command to write to disk unit 3. At time 28: P5 is swapped out. At time 33: An interrupt occurs from disk unit 2: P3’s read is complete. At time 36: An interrupt occurs from disk unit 3: P1’s read is complete. At time 38: P8 terminates. At time 40: An interrupt occurs from disk unit 3: P5’s write is complete. At time 44: P5 is swapped back in. At time 48: An interrupt occurs from disk unit 3: P7’s write is complete. For each time 22, 37, and 47, identify which state each process is in. If a process is blocked, further identify the event on which is it blocked.",14,0.996036661599,0.443088411831,0.694523,2
"Figure 3.9b contains seven states. In principle, one could draw a transition between any two states, for a total of 42 different transitions. List all of the possible transitions and give an example of what could cause each transition.",8,0.880796427129,0.452866010006,0.839814,2
"Figure 3.9b contains seven states. In principle, one could draw a transition between any two states, for a total of 42 different transitions. List all of the impossible transitions and explain why.",8,0.896847360933,0.455770363258,0.826977,2
"Figure 3.9b contains seven states. In principle, one could draw a transition between any two states, for a total of 42 different transitions. For the seven-state process model of Figure 3.9b, draw a queueing diagram similar to that of Figure 3.8b.",14,0.993626715354,0.420993124842,0.807938,2
"Consider the state transition diagram of Figure 3.9b. Suppose that it is time for the OS to dispatch a process and that there are processes in both the Ready state and the Ready/Suspend state, and that at least one process in the Ready/Suspend state has higher scheduling priority than any of the processes in the Ready state. Two extreme policies are as follows: (1) Always dispatch from a process in the Ready state, to minimize swapping, and (2) always give preference to the highest-priority process, even though that may mean swapping when swapping is not necessary. Suggest an intermediate policy that tries to balance the concerns of priority and performance.",17,0.556868438203,0.228497586046,0.771859,5
Table 3.13 shows the process states for the VAX/VMS operating system. Can you provide a justification for the existence of so many distinct wait states?,15,0.954929399943,0.377027072301,0.793963,3
"Table 3.13 shows the process states for the VAX/VMS operating system. Why do the following states not have resident and swapped-out versions: Page Fault Wait, Collided Page Wait, Common Event Wait, Free Page Wait, and Resource Wait?",15,0.969321463283,0.37167725519,0.748513,3
Table 3.13 shows the process states for the VAX/VMS operating system. Draw the state transition diagram and indicate the action or occurrence that causes each transition.,13,0.948728773926,0.319517250834,0.821065,1
"The VAX/VMS operating system makes use of four processor access modes to facilitate the protection and sharing of system resources among processes. The access mode determines • Instruction execution privileges: What instructions the processor may execute • Memory access privileges: Which locations in virtual memory the current instruction may access. The four modes are as follows: • Kernel: Executes the kernel of the VMS operating system, which includes memory management, interrupt handling, and I/O operations • Executive: Executes many of the OS service calls, including file and record (disk and tape) management routines • Supervisor: Executes other OS services, such as responses to user commands • User: Executes user programs, plus utilities such as compilers, editors, linkers, and debuggers. A process executing in a less-privileged mode often needs to call a procedure that executes in a more-privileged mode; for example, a user program requires an operating system service. This call is achieved by using a change-mode (CHM) instruction, which causes an interrupt that transfers control to a routine at the new access mode. A return is made by executing the REI (return from exception or interrupt) instruction. A number of operating systems have two modes, kernel and user. What are the advantages and disadvantages of providing four modes instead of two?",16,0.990568406579,0.282696552367,0.653815,4
"The VAX/VMS operating system makes use of four processor access modes to facilitate the protection and sharing of system resources among processes. The access mode determines • Instruction execution privileges: What instructions the processor may execute • Memory access privileges: Which locations in virtual memory the current instruction may access. The four modes are as follows: • Kernel: Executes the kernel of the VMS operating system, which includes memory management, interrupt handling, and I/O operations • Executive: Executes many of the OS service calls, including file and record (disk and tape) management routines • Supervisor: Executes other OS services, such as responses to user commands • User: Executes user programs, plus utilities such as compilers, editors, linkers, and debuggers. A process executing in a less-privileged mode often needs to call a procedure that executes in a more-privileged mode; for example, a user program requires an operating system service. This call is achieved by using a change-mode (CHM) instruction, which causes an interrupt that transfers control to a routine at the new access mode. A return is made by executing the REI (return from exception or interrupt) instruction. Can you make a case for even more than four modes?",16,0.977230637612,0.269534556312,0.646785,4
"The VMS scheme discussed in the preceding problem is often referred to as a ring protection structure, as illustrated in Figure 3.18. Indeed, the simple kernel/user scheme, as described in Section 3.3, is a two-ring structure. [SILB04] points out a problem with this approach: The main disadvantage of the ring (hierarchical) structure is that it does not allow us to enforce the need-to-know principle. In particular, if an object must be accessible in domain Dj but not accessible in domain Di, then we must have j 6 i. But this means that every segment accessible in Di is also accessible in Dj. Explain clearly what the problem is that is referred to in the preceding quote.",15,0.958530435263,0.4033043083,0.710036,3
Figure 3.8b suggests that a process can only be in one event queue at a time. Is it possible that you would want to allow a process to wait on more than one event at the same time? Provide an example.,9,0.38804263527,0.435833169797,0.838986,3
"Figure 3.8b suggests that a process can only be in one event queue at a time. In that case, how would you modify the queueing structure of the figure to support this new feature?",17,0.811831579093,0.406369299671,0.749935,5
"In a number of early computers, an interrupt caused the register values to be stored in fixed locations associated with the given interrupt signal. Under what circumstances is this a practical technique? Explain why it is inconvenient in general.",16,0.648363994888,0.426088801732,0.567688,4
"In Section 3.4, it was stated that UNIX is unsuitable for real-time applications because a process executing in kernel mode may not be preempted. Elaborate.",9,0.765061302258,0.20563468142,0.719822,3
"You have executed the following C program: <CODE> What are the possible outputs, assuming the fork succeeded?",13,0.774469863152,0.423743698232,0.512627,1
"It was pointed out that two advantages of using multiple threads within a process are that (1) less work is involved in creating a new thread within an existing process than in creating a new process, and (2) communication among threads within the same process is simplified. Is it also the case that a mode switch between two threads within the same process involves less work than a mode switch between two threads in different processes?",9,0.754404820748,0.297119370003,0.826866,3
"In the discussion of ULTs versus KLTs, it was pointed out that a disadvantage of ULTs is that when a ULT executes a system call, not only is that thread blocked, but also all of the threads within the process are blocked. Why is that so?",7,0.899757493586,0.415811420227,0.843423,1
"OS/2 is an obsolete OS for PCs from IBM. In OS/2, what is commonly embodied in the concept of process in other operating systems is split into three separate types of entities: session, processes, and threads. A session is a collection of one or more processes associated with a user interface (keyboard, display, and mouse). The session represents an interactive user application, such as a word processing program or a spreadsheet. This concept allows the personal-computer user to open more than one application, giving each one or more windows on the screen. The OS must keep track of which window, and therefore which session, is active, so that keyboard and mouse input are routed to the appropriate session. At any time, one session is in foreground mode, with other sessions in background mode. When a session is in foreground mode, a process performing video output sends it directly to the hardware video buffer and thence to the user’s screen. When the session is moved to the background, the hardware video buffer is saved to a logical video buffer for that session. While a session is in background, if any of the threads of any of the processes of that session executes and produces screen output, that output is directed to the logical video buffer. When the session returns to foreground, the screen is updated to reflect the current contents of the logical video buffer for the new foreground session. There is a way to reduce the number of process-related concepts in OS/2 from three to two. Eliminate sessions, and associate the user interface (keyboard, mouse, and screen) with processes. Thus, one process at a time is in foreground mode. For further structuring, processes can be broken up into threads. a. What benefits are lost with this approach? b. If you go ahead with this modification, where do you assign resources (memory, files, etc.): at the process or thread level?",16,0.999612108125,0.745856292074,0.832438,4
Consider an environment in which there is a one-to-one mapping between user-level threads and kernel-level threads that allows one or more threads within a process to issue blocking system calls while other threads continue to run. Explain why this model can make multithreaded programs run faster than their single-threaded counterparts on a uniprocessor computer.,15,0.885164878669,0.399642883623,0.827298,3
"If a process exits and there are still threads of that process running, will they continue to run?",0,0.412676455009,0.377910648184,0.694955,0
"The OS/390 mainframe operating system is structured around the concepts of address space and task. Roughly speaking, a single address space corresponds to a single application and corresponds more or less to a process in other operating systems. Within an address space, a number of tasks may be generated and execute concurrently; this corresponds roughly to the concept of multithreading. Two data structures are key to managing this task structure. An address space control block (ASCB) contains information about an address space needed by OS/390 whether or not that address space is executing. Information in the ASCB includes dispatching priority, real and virtual memory allocated to this address space, the number of ready tasks in this address space, and whether each is swapped out. A task control block (TCB) represents a user program in execution. It contains information needed for managing a task within an address space, including processor status information, pointers to programs that are part of this task, and task execution state. ASCBs are global structures maintained in system memory, while TCBs are local structures maintained within their address space. What is the advantage of splitting the control information into global and local portions?",15,0.998499676092,0.330116577851,0.466261,3
"Many current language specifications, such as for C and C++, are inadequate for multithreaded programs. This can have an impact on compilers and the correctness of code, as this problem illustrates. Consider the following declarations and function definition: <CODE> Now consider the case in which thread A performs <CODE> while thread B performs <CODE> What does the function do?",15,0.971930067382,0.968480130264,0.796855,3
"Many current language specifications, such as for C and C++, are inadequate for multithreaded programs. This can have an impact on compilers and the correctness of code, as this problem illustrates. Consider the following declarations and function definition: <CODE> Now consider the case in which thread A performs <CODE> while thread B performs <CODE> The C language only addresses single-threaded execution. Does the use of two parallel threads create any problems or potential problems?",1,0.886920594856,0.963740213929,0.866675,1
"But some existing optimizing compilers (including gcc, which tends to be relatively conservative) will “optimize” count_positives to something similar to <CODE> What problem or potential problem occurs with this compiled version of the program if threads A and B are executed concurrently?",9,0.915655895947,0.475673071316,0.696349,3
"Consider the following code using the POSIX Pthreads API: <CODE> In main() we first declare a variable called mythread, which has a type of pthread_t. This is essentially an ID for a thread. Next, the if statement creates a thread associated with mythread. The call pthread_create() returns zero on success and a nonzero value on failure. The third argument of pthread_ create() is the name of a function that the new thread will execute when it starts. When this thread_function() returns, the thread terminates. Meanwhile, the main program itself defines a thread, so that there are two threads executing. The pthread_join function enables the main thread to wait until the new thread completes. What does this program accomplish?",13,0.999493217111,0.444770055537,0.838058,1
"Consider the following code using the POSIX Pthreads API: <CODE> In main() we first declare a variable called mythread, which has a type of pthread_t. This is essentially an ID for a thread. Next, the if statement creates a thread associated with mythread. The call pthread_create() returns zero on success and a nonzero value on failure. The third argument of pthread_ create() is the name of a function that the new thread will execute when it starts. When this thread_function() returns, the thread terminates. Meanwhile, the main program itself defines a thread, so that there are two threads executing. The pthread_join function enables the main thread to wait until the new thread completes. Here is the output from the executed program: Is this the output you would expect? If not, what has gone wrong?",15,0.999796555513,0.50950519109,0.826826,3
The Solaris documentation states that a ULT may yield to another thread of the same priority. Isn’t it possible that there will be a runnable thread of higher priority and that therefore the yield function should result in yielding to a thread of the same or higher priority?,15,0.988131743269,0.502153768601,0.786575,3
"In Solaris 9 and Solaris 10, there is a one-to-one mapping between ULTs and LWPs.  What is the possible benefit of allowing a many-to-one mapping of ULTs to LWPs?",9,0.889117923556,0.87080369523,0.643079,3
"In Solaris 8, a single LWP supports one or more ULTs. In Solaris 8, the thread execution state of a ULT is distinct from that of its LWP. Explain why.",9,0.495055005276,0.782099766687,0.918924,3
Figure 4.17 shows the state transition diagrams for a ULT and its associated LWP in Solaris 8 and 9. Explain the operation of the two diagrams and their relationships.,7,0.916092170911,0.216331545807,0.720397,1
Explain the rationale for the Uninterruptible state in Linux.,1,0.821494114525,0.265765916367,0.452069,1
"At the beginning of Section 5.1, it is stated that multiprogramming and multiprocessing present the same problems, with respect to concurrency. This is true as far as it goes. However, cite two differences in terms of concurrency between multiprogramming and multiprocessing.",7,0.797160505564,0.223093751608,0.755054,1
"Consider the following program: <CODE> Note that the scheduler in a uniprocessor system would implement pseudo-parallel execution of these two concurrent processes by interleaving their instructions, without restriction on the order of the interleaving. Show a sequence (i.e., trace the sequence of interleavings of statements) such that the statement “x is 10” is printed.",1,0.831373335259,0.153999629221,0.51476,1
"Consider the following program: <CODE> Note that the scheduler in a uniprocessor system would implement pseudo-parallel execution of these two concurrent processes by interleaving their instructions, without restriction on the order of the interleaving. Show a sequence such that the statement “x is 8” is printed. You should remember that the increment/decrements at the source language level are not done atomically, that is, the assembly language code: <CODE> implements the single C increment instruction (x = x + 1).",1,0.991278190402,0.229031956691,0.535801,1
Consider the following program: <CODE> Determine the proper lower bound and upper bound on the final value of the shared variable tally output by this concurrent program. Assume processes can execute at any relative speed and that a value can only be incremented after it has been loaded into a register by a separate machine instruction.,9,0.970991199385,0.223354928542,0.452731,3
Consider the following program: <CODE> Suppose that an arbitrary number of these processes are permitted to execute in parallel under the assumptions of part (a). What effect will this modification have on the range of final values of tally?,9,0.897593878951,0.202592763767,0.486641,3
Is busy waiting always less efficient (in terms of using processor time) than a blocking wait? Explain.,7,0.361623099875,0.254029640008,0.389271,1
Consider the following program: <CODE> This software solution to the mutual exclusion problem for two processes is proposed in [HYMA66]. Find a counterexample that demonstrates that this solution is incorrect. It is interesting to note that even the Communications of the ACM was fooled on this one.,16,0.987423726576,0.232606571965,0.707558,4
"A software approach to mutual exclusion is Lamport’s bakery algorithm [LAMP74], so called because it is based on the practice in bakeries and other shops in which every customer receives a numbered ticket on arrival, allowing each to be served in turn. The algorithm is as follows: <CODE> The arrays choosing and number are initialized to false and 0, respectively. The ith element of each array may be read and written by process i but only read by other processes. The notation (a, b) < (c, d) is defined as: ( a < c ) or ( a = c and b < d ) Describe the algorithm in words.",13,0.972936766758,0.216526068617,0.681577,1
"A software approach to mutual exclusion is Lamport’s bakery algorithm [LAMP74], so called because it is based on the practice in bakeries and other shops in which every customer receives a numbered ticket on arrival, allowing each to be served in turn. The algorithm is as follows: <CODE> Show that this algorithm avoids deadlock.",15,0.807722645089,0.174502264948,0.619573,3
"A software approach to mutual exclusion is Lamport’s bakery algorithm [LAMP74], so called because it is based on the practice in bakeries and other shops in which every customer receives a numbered ticket on arrival, allowing each to be served in turn. The algorithm is as follows: <CODE> Show that it enforces mutual exclusion.",15,0.838626217947,0.183299013658,0.648315,3
Now consider a version of the bakery algorithm without the variable choosing. Then we have <CODE> Does this version violate mutual exclusion? Explain why or why not.,15,0.915223941805,0.227337657973,0.672105,3
"Consider the following program which provides a software approach to mutual exclusion: integer array control [1 :N]; integer k where 1 ≤ k ≤ N, and each element of “control” is either 0, 1, or 2. All elements of “control” are initially zero; the initial value of k is immaterial. The program of the ith process (1 ≤ i ≤ N) is begin integer j; <CODE> This is referred to as the Eisenberg-McGuire algorithm. Explain its operation and its key features.",15,0.99633665696,0.275932510738,0.636518,3
"When a special machine instruction is used to provide mutual exclusion in the fashion of Figure 5.2, there is no control over how long a process must wait before being granted access to its critical section. Devise an algorithm that uses the compare&swap instruction but that guarantees that any process waiting to enter its critical section will do so within n – 1 turns, where n is the number of processes that may require access to the critical section and a “turn” is an event consisting of one process leaving the critical section and another process being granted access.",17,0.751007874019,0.306602222722,0.843303,5
"Consider the following definition of semaphores: <CODE> Compare this set of definitions with that of Figure 5.3. Note one difference: With the preceding definition, a semaphore can never take on a negative value. Is there any difference in the effect of the two sets of definitions when used in programs? That is, could you substitute one set for the other without altering the meaning of the program?",15,0.911698351893,0.309340976717,0.726831,3
"Consider a sharable resource with the following characteristics: (1) As long as there are fewer than three processes using the resource, new processes can start using it right away. (2) Once there are three process using the resource, all three must leave before any new processes can begin using it. We realize that counters are needed to keep track of how many processes are waiting and active, and that these counters are themselves shared resources that must be protected with mutual exclusion. So we might create the following solution: <CODE> The program is nevertheless incorrect. Explain why.",15,0.998148580746,0.276297196548,0.552764,3
