Questions,Manual Label,NSQ,LDA,LSA,Cognitive
"Maximum urgency first (MUF) is a real-time scheduling algorithm for periodic tasks. Each task is assigned an urgency that is defined as a combination of two fixed priorities and one dynamic priority. One of the fixed priorities, the criticality, has precedence over the dynamic priority. Meanwhile, the dynamic priority has precedence over the other fixed priority, called the user priority. The dynamic priority is inversely proportional to the laxity of a task. MUF can be explained as follows. First, tasks are ordered from shortest to longest period. Define the critical task set as the first N tasks such that worst-case processor utilization does not exceed 100%. Among critical set tasks that are ready, the scheduler selects the task with the least laxity. If no critical set tasks are ready, the schedule chooses among the noncritical tasks the one with the least laxity. Ties are broken through an optional user priority and then by FCFS. Repeat Problem 10.3d, adding MUF to the diagrams. Assume that user-defined priorities are A highest, B next, C lowest. Comment on the results.",15,0.999915713794,0.30853524694,0.780614,3
Consider a program that accesses a single I/O device and compare unbuffered I/O to the use of a buffer. Show that the use of the buffer can reduce the running time by at most a factor of two.,14,0.608849899989,0.36769284643,0.706509,2
Consider a program that accesses n I/O devices and compare unbuffered I/O to the use of a buffer. Compare the running time with and without the use of the buffer.,4,0.628268865823,0.241344720283,0.622793,4
"Consider a disk with N tracks numbered from 0 to (N - 1) and assume that requested sectors are distributed randomly and evenly over the disk. We want to calculate the average number of tracks traversed by a seek. Calculate the probability of a seek of length j when the head is currently positioned over track t. (Hint: This is a matter of determining the total number of combinations, recognizing that all track positions for the destination of the seek are equally likely.)",4,0.895386143351,0.576310133415,0.947454,4
"Consider a disk with N tracks numbered from 0 to (N - 1) and assume that requested sectors are distributed randomly and evenly over the disk. We want to calculate the average number of tracks traversed by a seek. Calculate the probability of a seek of length K, for an arbitrary current position of the head. (Hint: This involves the summing over all possible combinations of movements of K tracks.)",4,0.917181938902,0.622944515881,0.902888,4
"Consider a disk with N tracks numbered from 0 to (N - 1) and assume that requested sectors are distributed randomly and evenly over the disk. We want to calculate the average number of tracks traversed by a seek. Calculate the average number of tracks traversed by a seek, using the formula for expected value N-1 E[x]= ai* Pr[x=i] n Hint: Use the equalities a = i=0 n(n + 1) ; n n(n + 1)(2n + 1) ai2 = 6 . i=1  2",4,0.911886435011,0.49657007375,0.87823,4
The following equation was suggested both for cache memory and disk cache memory: TS =TC +M*TD Generalize this equation to a memory hierarchy with N levels instead of just 2.,16,0.849155185991,0.368115416469,0.819808,4
"For the frequency-based replacement algorithm (Figure 11.9), define Fnew, Fmiddle, and Fold as the fraction of the cache that comprises the new, middle, and old sections, respectively. Clearly, Fnew + Fmiddle + Fold = 1. Characterize the policy when a. Fold =1-Fnew b. Fold = 1/(cache size)",8,0.991966055639,0.276373361177,0.601285,2
"Calculate how much disk space (in sectors, tracks, and surfaces) will be required to store 300,000 120-byte logical records if the disk is fixed sector with 512 bytes/ sector, with 96 sectors/track, 110 tracks per surface, and 8 usable surfaces. Ignore any file header record(s) and track indexes, and assume that records cannot span two sectors.",4,0.996847975659,0.402390866894,0.694507,4
"Consider the disk system described in Problem 11.7, and assume that the disk rotates at 360 rpm. A processor reads one sector from the disk using interrupt-driven I/O, with one interrupt per byte. If it takes 2.5 μs to process each interrupt, what percentage of the time will the processor spend handling I/O (disregard seek time)?",4,0.991380666364,0.352674233583,0.714925,4
"A 32-bit computer has two selector channels and one multiplexor channel. Each selector channel supports two magnetic disk and two magnetic tape units. The multiplexor channel has two line printers, two card readers, and ten VDT terminals connected to it. Assume the following transfer rates: Disk drive 800 Kbytes/s Magnetic tape drive 200 Kbytes/s Line printer 6.6 Kbytes/s Card reader 1.2 Kbytes/s VDT 1 Kbyte/s. Estimate the maximum aggregate I/O transfer rate in this system.",4,0.998972608831,0.832859903359,0.85584,4
"It should be clear that disk striping can improve the data transfer rate when the strip size is small compared to the I/O request size. It should also be clear that RAID 0 provides improved performance relative to a single large disk, because multiple I/O requests can be handled in parallel. However, in this latter case, is disk striping necessary? That is, does disk striping improve I/O request rate performance compared to a comparable disk array without striping?",9,0.921304020322,0.781716480618,0.778572,3
"Consider a 4-drive, 200 GB-per-drive RAID array. What is the available data storage capacity for each of the RAID levels, 0, 1, 3, 4, 5, and 6?",4,0.779372007823,0.701253554112,0.971577,4
"Define: B   block size, R   record size, P   size of block pointer, F   blocking factor;",0,0.439710387749,0.392928086199,0.613931,0
Give a formula for F for the three blocking methods depicted in Figure 12.8.,10,0.6277248347,0.431413378844,0.652381,4
"One scheme to avoid the problem of preallocation versus waste or lack of contiguity is to allocate portions of increasing size as the file grows. For example, begin with a portion size of one block, and double the portion size for each allocation. Consider a file of n records with a blocking factor of F, and suppose that a simple one-level index is used as a file allocation table. Give an upper limit on the number of entries in the file allocation table as a function of F and n.",10,0.685061575804,0.360140746869,0.904436,4
"One scheme to avoid the problem of preallocation versus waste or lack of contiguity is to allocate portions of increasing size as the file grows. For example, begin with a portion size of one block, and double the portion size for each allocation. Consider a file of n records with a blocking factor of F, and suppose that a simple one-level index is used as a file allocation table. What is the maximum amount of the allocated file space that is unused at any time?",10,0.774707467449,0.3531292254,0.874098,4
"What file organization would you choose to maximize efficiency in terms of speed of access, use of storage space, and ease of updating (adding/deleting/modifying) when the data are a. updated infrequently and accessed frequently in random order? b. updated frequently and accessed in its entirety relatively frequently? c. updated frequently and accessed frequently in random order?",6,0.998865765004,0.24467531016,0.356955,0
"For the B-tree in Figure 12.4c, show the result of inserting the key 97.",16,0.757061692391,0.962200242658,0.887856,4
"An alternative algorithm for insertion into a B-tree is the following: As the insertion algorithm travels down the tree, each full node that is encountered is immediately split, even though it may turn out that the split was unnecessary. What is the advantage of this technique? What are the disadvantages?",1,0.860606371747,0.319155881259,0.820536,1
Both the search and the insertion time for a B-tree are a function of the height of the tree. We would like to develop a measure of the worst-case search or insertion time. Consider a B-tree of degree d that contains a total of n keys. Develop an inequality that shows an upper bound on the height h of the tree as a function of d and n.,17,0.996486546859,0.506044295673,0.859688,5
"Ignoring overhead for directories and file descriptors, consider a file system in which files are stored in blocks of 16K bytes. For each of the following file sizes, calculate the percentage of wasted file space due to incomplete filling of the last block: 41,600 bytes; 640,000 bytes; 4.064,000 bytes.",4,0.988158729173,0.338879162068,0.583467,4
What are the advantages of using directories?,0,0.644306997559,0.742057469834,0.369699,0
Directories can be implemented either as “special files” that can only be accessed in limited ways or as ordinary data files. What are the advantages and disadvantages of each approach?,0,0.956248770807,0.400385636296,0.612191,0
Some operating systems have a tree–structured file system but limit the depth of the tree to some small number of levels. What effect does this limit have on users? How does this simplify file system design (if it does)?,9,0.826367327883,0.323573272781,0.525748,3
Consider a hierarchical file system in which free disk space is kept in a free space list. Suppose the pointer to free space is lost. Can the system reconstruct the free space list?,3,0.953262596854,0.616951358419,0.767128,3
Consider a hierarchical file system in which free disk space is kept in a free space list. Suggest a scheme to ensure that the pointer is never lost as a result of a single memory failure.,5,0.808985126037,0.344668003659,0.74573,5
"In UNIX System V, the length of a block is 1 Kbyte, and each block can hold a total of 256 block addresses. Using the inode scheme, what is the maximum size of a file?",4,0.889668644803,0.284441098968,0.539053,4
"Consider the organization of a UNIX file as represented by the inode (Figure 12.16). Assume that there are 12 direct block pointers, and a singly, doubly, and triply indirect pointer in each inode. Further, assume that the system block size and the disk sector size are both 8K. If the disk block pointer is 32 bits, with 8 bits to identify the physical disk and 24 bits to identify the physical block, then what is the maximum file size supported by this system? What is the maximum file system partition supported by this system?",4,0.999432940551,0.299880176899,0.595931,4
"Consider the organization of a UNIX file as represented by the inode (Figure 12.16). Assume that there are 12 direct block pointers, and a singly, doubly, and triply indirect pointer in each inode. Further, assume that the system block size and the disk sector size are both 8K. If the disk block pointer is 32 bits, with 8 bits to identify the physical disk and 24 bits to identify the physical block. Assuming no information other than that the file inode is already in main memory, how many disk accesses are required to access the byte in position 13,423,956?",4,0.998801193368,0.249438674255,0.6231,4
"With reference to the device driver interface to the eCos kernel (Table 13.2), it is recommended that device drivers should use the _intsave() variants to claim and release spinlocks rather than the non-_intsave() variants. Explain why.",0,0.850126810142,0.264599852896,0.569358,0
"In Table 13.2, it is recommended that cyg_drv_spinlock_spin should be used sparingly, and in situations where deadlocks/livelocks cannot occur. Explain why.",1,0.989637235996,0.314338331854,0.569952,1
"In Table 13.2, what should be the limitations on the use of cyg_drv_spinlock_ destroy? Explain.",0,0.87889782088,0.376266724417,0.553678,0
"In Table 13.2, what limitations should be placed in the use of cyg_drv_mutex_ destroy?",0,0.87889782088,0.357532144905,0.522537,0
Why does the eCos bitmap scheduler not support time slicing?,0,0.971927500656,0.528026028261,0.763167,0
"The implementation of mutexes within the eCos kernel does not support recursive locks. If a thread has locked a mutex and then attempts to lock the mutex again, typically as a result of some recursive call in a complicated call graph, then either an assertion failure will be reported or the thread will deadlock. Suggest a reason for this policy.",1,0.867108670787,0.322114054297,0.769168,1
Figure 13.14 is a listing of code intended for use on the eCos kernel. Explain the operation of the code. Assume thread B begins execution first and thread A begins to execute after some event occurs.,1,0.514282531298,0.299301401647,0.718587,1
"Figure 13.14 is a listing of code intended for use on the eCos kernel. What would happen if the mutex unlock and wait code execution in the call to cyg_cond_wait, on line 30, were not atomic?",0,0.49697145858,0.24200316266,0.777788,0
Figure 13.14 is a listing of code intended for use on the eCos kernel. Why is the while loop on line 26 needed?,3,0.772833291915,0.305626847315,0.694109,3
The discussion of eCos spinlocks included an example showing why spinlocks should not be used on a uniprocessor system if two threads of different priorities can compete for the same spinlock. Explain why the problem still exists even if only threads of the same priority can claim the same spinlock.,9,0.948747078539,0.334249348073,0.553826,3
"TinyOS’s scheduler serves tasks in FIFO order. Many other schedulers for TinyOS have been proposed, but none have caught on. What characteristics of the sensornet domain might cause a lack of need for more complex scheduling?",0,0.987952210634,0.369904485243,0.538702,0
The TinyOS Resource interface does not allow a component that already has a request in the queue for a resource to make a second request. Suggest a reason.,1,0.367094889654,0.546595493127,0.817203,1
The TinyOS Resource interface allows a component holding the resource lock to re-request the lock. This request is enqueued for a later grant. Suggest a reason for this policy. Hint: What might cause there to be latency between one component releasing a lock and the next requester being granted it?,1,0.91751628189,0.372865209255,0.7632,1
"Consider an automated teller machine (ATM) in which users provide a personal identification number (PIN) and a card for account access. Give examples of confidentiality, integrity, and availability requirements associated with the system and, in each case, indicate the degree of importance of the requirement.",11,0.487210804642,0.623745261928,0.645865,5
Repeat the preceding problem for a telephone switching system that routes calls through a switching network based on the telephone number requested by the caller.,17,0.375535859561,0.919698987919,0.5508,5
Consider a desktop publishing system used to produce documents for various organizations. Give an example of a type of publication for which a. confidentiality of the stored data is the most important requirement b. data integrity is the most important requirement. c. system availability is the most important requirement.,11,0.627688747713,0.886501291118,0.725801,5
"For each of the following assets, assign a low, moderate, or high impact level for the loss of confidentiality, availability, and integrity, respectively. Justify your answers. <EXAMPLES>",0,0.964213503174,1.0,0.738003,0
"Assume that passwords are selected from four-character combinations of 26 alphabetic characters. Assume that an adversary is able to attempt passwords at a rate of one per second.  What is the expected time to discover the correct password? a. Assuming no feedback to the adversary until each attempt has been completed, b. Assuming feedback to the adversary flagging an error as each incorrect character is entered",4,0.99880579342,0.948849644997,0.753823,4
"The question arises as to whether it is possible to develop a program that can Analyse a piece of software to determine if it is a virus. Consider that we have a program D that is supposed to be able to do that. That is, for any program P, if we run D(P), the result returned is TRUE (P is a virus) or FALSE (P is not a virus). Now consider the following program: <CODE> In the preceding program, infect-executable is a module that scans memory for executable programs and replicates itself in those programs. Determine if D can correctly decide whether CV is a virus.",3,0.729926418346,0.914067416866,0.729442,3
Consider the following fragment: <CODE> What type of malicious software is this?,1,0.664711697955,1.0,0.57668,1
Consider the following fragment in an authentication program: <CODE> What type of malicious software is this?,1,0.629460731338,1.0,0.725762,1
The following code fragments show a sequence of virus instructions and a polymorphic version of the virus. Describe the effect produced by the metamorphic code.,15,0.721858752447,0.833205413174,0.736736,3
Explain the suitability or unsuitability of the following passwords: a. YK 334 b. mfmitm (for “my favorite movie is tender mercies”) c. Natalie1 d. Washington e. Aristotle f. tv9stove g. 12345678 h. dribgib,0,0.987870194379,0.465852494126,0.473415,0
"An early attempt to force users to use less predictable passwords involved computer supplied passwords. The passwords were eight characters long and were taken from the character set consisting of lowercase letters and digits. They were generated by a pseudorandom number generator with 215 possible starting values. Using the technology of the time, the time required to search through all character strings of length 8 from a 36-character alphabet was 112 years. Unfortunately, this is not a true reflection of the actual security of the system. Explain the problem.",7,0.994261093577,0.484904231726,0.817017,1
"Assume that passwords are selected from four-character combinations of 26 alphabetic characters. Assume that an adversary is able to attempt passwords at a rate of one per second. a. Assuming no feedback to the adversary until each attempt has been completed, what is the expected time to discover the correct password? b. Assuming feedback to the adversary flagging an error as each incorrect character is entered, what is the expected time to discover the correct password?",4,0.99880579342,1.0,0.742478,4
"Assume that source elements of length k are mapped in some uniform fashion into a target elements of length p. If each digit can take on one of r values, then the number of source elements is rk and the number of target elements is the smaller number rp. A particular source element xi is mapped to a particular target element yj. What is the probability that the correct source element can be selected by an adversary on one try? What is the probability that a different source element xk (xi ≠ xk) that results in the same target element, yj, could be produced by an adversary? What is the probability that the correct target element can be produced by an adversary on one try?",4,0.999736198039,0.484904231726,0.835284,4
Assume that passwords are limited to the use of the 95 printable ASCII characters and that all passwords are 10 characters in length. Assume a password cracker with an encryption rate of 6.4 million encryptions per second. How long will it take to test exhaustively all possible passwords on a UNIX system?,4,0.977118056098,0.484904231726,0.799438,4
"Because of the known risks of the UNIX password system, the SunOS-4.0 documentation recommends that the password file be removed and replaced with a publicly readable file called /etc/publickey. An entry in the file for user A consists of a user’s identifier IDA, the user’s public key, PUa, and the corresponding private key, PRa. This private key is encrypted using DES with a key derived from the user’s login password Pa. When A logs in, the system decrypts E(Pa, PRa) to obtain PRa. The system then verifies that Pa was correctly supplied. How?",13,0.998832550977,0.463645323335,0.725752,1
"Because of the known risks of the UNIX password system, the SunOS-4.0 documentation recommends that the password file be removed and replaced with a publicly readable file called /etc/publickey. An entry in the file for user A consists of a user’s identifier IDA, the user’s public key, PUa, and the corresponding private key, PRa. This private key is encrypted using DES with a key derived from the user’s login password Pa. When A logs in, the system decrypts E(Pa, PRa) to obtain PRa. How can an opponent attack this system?",13,0.999239060569,0.462717871199,0.738469,1
"It was stated that the inclusion of the salt in the UNIX password scheme increases the difficulty of guessing by a factor of 4096. But the salt is stored in plaintext in the same entry as the corresponding ciphertext password. Therefore, those two characters are known to the attacker and need not be guessed. Why is it asserted that the salt increases security?",7,0.987076625465,0.294602310792,0.817351,1
"Assuming that you have successfully answered the preceding problem and understand the significance of the salt, here is another question. Wouldn’t it be possible to thwart completely all password crackers by dramatically increasing the salt size to, say, 24 or 48 bits?",8,0.996671239697,0.450067401906,0.732901,2
"For the DAC model discussed in Section 15.2, an alternative representation of the protection state is a directed graph. Each subject and each object in the protection state is represented by a node (a single node is used for an entity that is both subject and object). A directed line from a subject to an object indicates an access right, and the label on the link defines the access right. Draw a directed graph that corresponds to the access matrix of Figure 12.15a.",2,0.946461704906,0.291114708849,0.613193,2
"For the DAC model discussed in Section 15.2, an alternative representation of the protection state is a directed graph. Each subject and each object in the protection state is represented by a node (a single node is used for an entity that is both subject and object). A directed line from a subject to an object indicates an access right, and the label on the link defines the access right. Is there a one-to-one correspondence between the directed graph representation and the access matrix representation? Explain.",7,0.714739953624,0.334206560557,0.632322,1
"UNIX treats file directories in the same fashion as files; that is, both are defined by the same type of data structure, called an inode. As with files, directories include a 9-bit protection string. If care is not taken, this can create access control problems. For example, consider a file with protection mode 644 (octal) contained in a directory with protection mode 730. How might the file be compromised in this case?",1,0.649774101547,0.348209593392,0.499376,1
"In the traditional UNIX file access model, UNIX systems provide a default setting for newly created files and directories, which the owner may later change. The default is typically full access for the owner combined with one of the following: no access for group and other, read/execute access for group and none for other, or read/execute access for both group and other. Briefly discuss the advantages and disadvantages of each of these cases, including an example of a type of organization where each would be appropriate.",0,0.687394178793,0.384817803176,0.571416,0
"Consider user accounts on a system with a Web server configured to provide access to user Web areas. In general, this scheme uses a standard directory name, such as public_ html, in a user’s home directory. This acts as the user’s Web area if it exists. However, to allow the Web server to access the pages in this directory, it must have at least search (execute) access to the user’s home directory, read/execute access to the Web directory, and read access to any Web pages in it. Consider the interaction of this requirement with the cases you discussed for the preceding problem. What consequences does this requirement have? Note that a Web server typically executes as a special user, and in a group that is not shared with most users on the system. Are there some circumstances when running such a Web service is simply not appropriate? Explain.",9,0.972594179643,0.416280083314,0.711966,3
"Assume a system with N job positions. For job position i, the number of individual users in that position is Ui and the number of permissions required for the job position is Pi. For a traditional DAC scheme, how many relationships between users and permissions must be defined? Repeat the same for an RBAC scheme.",4,0.992515918335,0.46934818048,0.642449,4
"In the context of an IDS, we define a false positive to be an alarm generated by an IDS in which the IDS alerts to a condition that is actually benign. A false negative occurs when an IDS fails to generate an alarm when an alert-worthy condition is in effect. Using the following diagram, depict two curves that roughly indicate false positives and false negatives, respectively.",2,0.997597984315,0.484904231726,0.763334,2
"Let be the percentage of program code that can be executed simultaneously by n computers in a cluster, each computer using a different set of parameters or initial conditions. Assume that the remaining code must be executed sequentially by a single processor. Each processor has an execution rate of x MIPS. Derive an expression for the effective MIPS rate when using the system for exclusive execution of this program, in terms of n,   , and x.",23,0.963478525306,0.1917278658,0.474473,5
"Let be the percentage of program code that can be executed simultaneously by n computers in a cluster, each computer using a different set of parameters or initial conditions. Assume that the remaining code must be executed sequentially by a single processor. Each processor has an execution rate of x MIPS. If n   16 and x   4 MIPS, determine the value of that will yield a system performance of 40 MIPS.",21,0.981025827639,0.25509945124,0.396863,3
